{
  "schemaVersion": 1,
  "rulesetId": "championship-research-r1",
  "authority": "NEXUS_PRODUCT",
  "forensicCatalogExpectations": {
    "entities": 224,
    "actions": 596,
    "gates": 16,
    "cages": 40,
    "shopRecords": 118,
    "titleMatches": 62,
    "teams": 152,
    "battlePresets": 456,
    "eligibilityRules": 45,
    "battleFields": 11,
    "regularMainAnimationSlots": 40
  },
  "productScaleTargets": {
    "minimumAddressableCapacity": {
      "entities": 224,
      "actions": 596,
      "gates": 16,
      "cages": 40,
      "shopRecords": 118,
      "titleMatches": 62,
      "opponentTeams": 152,
      "battlePresets": 456
    },
    "maximumRecords": null
  },
  "initialSlice": {
    "creatureSpeciesIds": ["nexus:creature:greyshade-cat", "nexus:creature:blazetail-kit", "nexus:creature:crystalfin-seahorse"],
    "huntGateIds": ["nexus:championship:gate:moonlit-reed"],
    "shopRecordIds": ["nexus:championship:shop:reed-tonic", "nexus:championship:shop:willow-observatory"],
    "arenaMatchIds": ["nexus:championship:match:reedlight-trial"],
    "battleActionIds": ["nexus:championship:action:comet-pounce", "nexus:championship:action:tide-arc"]
  },
  "catalogDigests": {
    "entities": "2eb3599d46106a1aa4456beac333ca92acbba0a7f30a77b90d3623648a93fbd1",
    "actions": "21cad4bed516526b57470f73102211fde7119e6e2b9bd02bc715079023c61592",
    "gates": "e0e0eb0d719ef01758d4bd5736b79cd8cf171039177eb859e3869a0c8ef0ac7c",
    "cages": "365c668d5e3436ea99bf429cf4d7d00453b2d078bc882cf5e7099ab61c2437d3",
    "shopRecords": "0ecd5f374c05c74d4c4d0987530b144968ee30e3bd02e879522cc8ab2235534e",
    "titleMatches": "8eecef7dcd9fd9c3a48957f9647c37bffc516d5bde41a36f9ad4f028b3d7bf60",
    "eligibilityRules": "8ff827e7bcd333e1de5ad07138705b2ff30c66283078f4ba6b80fce2f4cb8685",
    "teams": "80019563f9bf6fdabbd1fbe775889a08d59ac17285f095c55fd63f2531689593",
    "battlePresets": "6319e927ef005be8c6579fb5b361795ddfdd8df2e5c3e85bc2839cf2f213e26c",
    "battleFields": "9339e1338d8ec5a083bcdd5021560f5afe5a093a12c0d3d02fc27c41e8794d73"
  },
  "entities": [
    {
      "speciesId": "nexus:creature:greyshade-cat",
      "displayNameKey": "championship.creature.greyshadeCat",
      "displayName": "Greyshade Cat",
      "assetRef": "nexus:shape:greyshade-cat-r1",
      "formKind": "BASE",
      "huntProfileRef": "nexus:championship:gate:moonlit-reed",
      "arenaFixtureRef": "nexus:championship:preset:greyshade-player",
      "sourceAuthority": "NEXUS_PRODUCT"
    },
    {
      "speciesId": "nexus:creature:blazetail-kit",
      "displayNameKey": "championship.creature.blazetailKit",
      "displayName": "Blazetail Kit",
      "assetRef": "nexus:shape:blazetail-kit-r1",
      "formKind": "BASE",
      "huntProfileRef": "nexus:championship:gate:moonlit-reed",
      "arenaFixtureRef": "nexus:championship:preset:blazetail-opponent",
      "sourceAuthority": "NEXUS_PRODUCT"
    },
    {
      "speciesId": "nexus:creature:crystalfin-seahorse",
      "displayNameKey": "championship.creature.crystalfinSeahorse",
      "displayName": "Crystalfin Seahorse",
      "assetRef": "nexus:shape:crystalfin-seahorse-r1",
      "formKind": "BASE",
      "huntProfileRef": null,
      "arenaFixtureRef": null,
      "sourceAuthority": "NEXUS_PRODUCT"
    }
  ],
  "actions": [
    {
      "actionId": "nexus:championship:action:comet-pounce",
      "displayNameKey": "championship.action.cometPounce",
      "displayName": "Comet Pounce",
      "targetRule": {
        "value": { "kind": "SINGLE_OPPONENT" },
        "ruleAuthority": "NEXUS_ADAPTATION",
        "evidenceStatus": "NEXUS_RESEARCH_RULE",
        "executable": true,
        "originalParityClaim": false,
        "evidenceRefs": []
      },
      "timelineRules": [
        {
          "value": { "kind": "FIXED_TURN" },
          "ruleAuthority": "NEXUS_ADAPTATION",
          "evidenceStatus": "NEXUS_RESEARCH_RULE",
          "executable": true,
          "originalParityClaim": false,
          "evidenceRefs": []
        }
      ],
      "effectRules": [
        {
          "value": { "kind": "DAMAGE", "magnitude": 18 },
          "ruleAuthority": "NEXUS_ADAPTATION",
          "evidenceStatus": "NEXUS_RESEARCH_RULE",
          "executable": true,
          "originalParityClaim": false,
          "evidenceRefs": []
        }
      ],
      "aggregateParity": { "status": "RESEARCH_NON_PARITY", "blockingFindingIds": [] }
    },
    {
      "actionId": "nexus:championship:action:tide-arc",
      "displayNameKey": "championship.action.tideArc",
      "displayName": "Tide Arc",
      "targetRule": {
        "value": { "kind": "SINGLE_OPPONENT" },
        "ruleAuthority": "NEXUS_ADAPTATION",
        "evidenceStatus": "NEXUS_RESEARCH_RULE",
        "executable": true,
        "originalParityClaim": false,
        "evidenceRefs": []
      },
      "timelineRules": [
        {
          "value": { "kind": "FIXED_TURN" },
          "ruleAuthority": "NEXUS_ADAPTATION",
          "evidenceStatus": "NEXUS_RESEARCH_RULE",
          "executable": true,
          "originalParityClaim": false,
          "evidenceRefs": []
        }
      ],
      "effectRules": [
        {
          "value": { "kind": "DAMAGE", "magnitude": 14 },
          "ruleAuthority": "NEXUS_ADAPTATION",
          "evidenceStatus": "NEXUS_RESEARCH_RULE",
          "executable": true,
          "originalParityClaim": false,
          "evidenceRefs": []
        }
      ],
      "aggregateParity": { "status": "RESEARCH_NON_PARITY", "blockingFindingIds": [] }
    }
  ],
  "gates": [
    {
      "gateId": "nexus:championship:gate:moonlit-reed",
      "fieldDefinitionId": "nexus:championship:field:moonlit-reed",
      "displayNameKey": "championship.gate.moonlitReed",
      "displayName": "Moonlit Reed Gate",
      "ecologyTags": ["wetland", "moonlight"],
      "presentationRef": "nexus:shape:moonlit-reed-gate-r1",
      "admissionRule": {
        "value": { "kind": "RESEARCH_OPEN" },
        "ruleAuthority": "NEXUS_ADAPTATION",
        "evidenceStatus": "NEXUS_RESEARCH_RULE",
        "executable": true,
        "originalParityClaim": false,
        "evidenceRefs": []
      },
      "fieldSelectionRule": {
        "value": { "fieldId": "nexus:championship:field:moonlit-reed" },
        "ruleAuthority": "NEXUS_ADAPTATION",
        "evidenceStatus": "NEXUS_RESEARCH_RULE",
        "executable": true,
        "originalParityClaim": false,
        "evidenceRefs": []
      }
    }
  ],
  "cages": [
    {
      "environmentId": "nexus:championship:cage:willow-observatory",
      "fieldDefinitionId": "nexus:championship:field:moonlit-reed",
      "projectNativePresentationRef": "nexus:shape:willow-observatory-r1",
      "topologyRule": {
        "value": { "kind": "SINGLE_RESEARCH_HABITAT" },
        "ruleAuthority": "NEXUS_ADAPTATION",
        "evidenceStatus": "NEXUS_RESEARCH_RULE",
        "executable": true,
        "originalParityClaim": false,
        "evidenceRefs": []
      },
      "dynamicSurfaceRules": []
    }
  ],
  "shopRecords": [
    {
      "shopRecordId": "nexus:championship:shop:reed-tonic",
      "category": "HUNT_ITEM",
      "subcategory": "RESEARCH_AID",
      "itemId": "nexus:championship:item:reed-tonic",
      "nameKey": "championship.item.reedTonic",
      "displayName": "Reed Tonic",
      "descriptionKey": "championship.item.reedTonic.description",
      "commitDomain": "INVENTORY",
      "availabilityRule": {
        "value": { "available": true },
        "ruleAuthority": "NEXUS_ADAPTATION",
        "evidenceStatus": "NEXUS_RESEARCH_RULE",
        "executable": true,
        "originalParityClaim": false,
        "evidenceRefs": []
      },
      "initialStockRule": {
        "value": { "count": 2 },
        "ruleAuthority": "NEXUS_ADAPTATION",
        "evidenceStatus": "NEXUS_RESEARCH_RULE",
        "executable": true,
        "originalParityClaim": false,
        "evidenceRefs": []
      },
      "capacityRule": {
        "value": { "maximum": 9 },
        "ruleAuthority": "NEXUS_ADAPTATION",
        "evidenceStatus": "NEXUS_RESEARCH_RULE",
        "executable": true,
        "originalParityClaim": false,
        "evidenceRefs": []
      },
      "priceRule": {
        "value": { "amount": 20 },
        "ruleAuthority": "NEXUS_ADAPTATION",
        "evidenceStatus": "NEXUS_RESEARCH_RULE",
        "executable": true,
        "originalParityClaim": false,
        "evidenceRefs": []
      },
      "evidenceRefs": []
    },
    {
      "shopRecordId": "nexus:championship:shop:willow-observatory",
      "category": "CAGE",
      "subcategory": "RESEARCH_ENVIRONMENT",
      "itemId": "nexus:championship:cage:willow-observatory",
      "nameKey": "championship.cage.willowObservatory",
      "displayName": "Willow Observatory",
      "descriptionKey": "championship.cage.willowObservatory.description",
      "commitDomain": "CAGE_OWNERSHIP",
      "availabilityRule": {
        "value": { "available": true },
        "ruleAuthority": "NEXUS_ADAPTATION",
        "evidenceStatus": "NEXUS_RESEARCH_RULE",
        "executable": true,
        "originalParityClaim": false,
        "evidenceRefs": []
      },
      "initialStockRule": {
        "value": { "count": 1 },
        "ruleAuthority": "NEXUS_ADAPTATION",
        "evidenceStatus": "NEXUS_RESEARCH_RULE",
        "executable": true,
        "originalParityClaim": false,
        "evidenceRefs": []
      },
      "capacityRule": {
        "value": { "maximum": 1 },
        "ruleAuthority": "NEXUS_ADAPTATION",
        "evidenceStatus": "NEXUS_RESEARCH_RULE",
        "executable": true,
        "originalParityClaim": false,
        "evidenceRefs": []
      },
      "priceRule": {
        "value": { "amount": 40 },
        "ruleAuthority": "NEXUS_ADAPTATION",
        "evidenceStatus": "NEXUS_RESEARCH_RULE",
        "executable": true,
        "originalParityClaim": false,
        "evidenceRefs": []
      },
      "evidenceRefs": []
    }
  ],
  "titleMatches": [
    {